Crime Date,Agency,Description,Type,Group
4-21-17,NEW CASTLE COUNTY PD,Identity Theft, ,
4-12-17,TROOP 2 STATE POLICE,Aggravated Assault/Non-Family Other Dangerous Weapon,Aggravated assault,VIOLENT
4-10-17,TROOP 2 STATE POLICE,Disorderly Conduct/Unrelated to Liquor,Disorderly conduct,OTHER
4-07-17,TROOP 2 STATE POLICE,Marijuana/Possession,Drugs,DRUGS
4-07-17,TROOP 2 STATE POLICE,Possession of Drug Paraphernalia,Drugs,DRUGS
4-03-17,TROOP 2 STATE POLICE,Offensive Touching/Other Assaults/Non-Aggravated,Assault,OTHER
4-03-17,TROOP 2 STATE POLICE,Disorderly Conduct/Unrelated to Liquor,Disorderly conduct,OTHER
